{
  "appeal_id": "APL-2026-00001",
  "filed_at": "2026-02-22T12:00:00Z",
  "receipt_ref": "RCP-2026-00042",
  "appellant": {
    "appellant_ref": "SUB-12345",
    "appellant_type": "subject"
  },
  "grounds": [
    "fact_error",
    "procedural_error"
  ],
  "statement": "The decision used an outdated address record. I request recomputation after registry correction.",
  "evidence_refs": [
    "DOC-ADDR-2026-02-10"
  ],
  "preferred_remedy": "recompute"
}
